{
	"id": "PointOfInterest-Transport-30707",
	"type": "Transport",
	"name": "ACLOC LOCATION DE VOITURE ET UTILITAIRE | ACLOC",
	"description": "MAJONE ....", 
	"url" : "http://www.acloc.fr",
	"faxNumber" : "+33(0)4 93 80 06 27",
	"telephone" : "+33(0)4 93 80 08 00",
	"email": "acloc@hotmail.fr",
	"address": {
		"addressCountry": "FR",
		"streetAddress": "455 Promenade des anglais"
	},
	"language": ["1", "2", "3"],
	"location": {
		"type": "Point",
		"coordinates": [
			7.26344, 
			43.7124
			]
	},
	"proximity" : ["Gare SNCF", "Acropolis", "Port", "Fabron", "Jean Médecin", "Gambetta", "Nice Est", "Centre Ville"],
	"category": ["10"],
	"sectors" : null, 
	"living" : {
		"roomCount" : 0,
		"roomBathCount" : 0,
		"roomShowerCount" :0,
		"suiteCount" : 0,
		"studioCount" : 0,
		"apartmentCount" : 0,
		"roomAccessibleCount" :0,
		"singleCount": 0,
		"doubleCount" :0,
		"tripleCount" :0,
		"twinsCount" : 0,
		"familyCount" : 0,
		"area" : 0,
		"typeLiving" : null,
		"floor" : 0,
		"bedroomCount" :1,
		"sleepsCount" :4,
		"furnishedRoomCount" :2
	},
	"tariffs" : null,
	"capacity" : {
		"indoor": 0,
		"outdoor": 0,
		"roomCount": 0,
		"seated": 0,
		"cocktail" : 0
	},
	"closures" : {
		"closureDay" : "Dimanche",
		"closureSpan" : "Toute la journée"
	},
	"spaces" : null,
	"openingHours" : "8:00-23:00 (lundi au samedi) - 10:00-23:00 (dimanche)",
	"closing" : "01/12-30/04",
	"source": null,
	"dateCreated": "2015-07-21 15:30:03",
	"dateUpdated": "2017-08-30 17:31:02", 
	"refSeeAlso": ["Transport-NCA-2017"]
}